=== GSM voice diagnosis 2026-06-26T10:59:43+05:00 ===
GSM media: 10.212.154.35 dev enp13s4f1; WebRTC: 172.16.6.183 dev enp6s0f0
Report: /opt/call-center/asterisk-cc-phase1/reports/gsm-voice-diagnosis-20260626-105943.txt

=== Routes ===
10.1.5.8/29 via 172.16.4.1 dev enp13s4f0 
10.1.5.64/27 via 10.212.154.34 dev enp13s4f1 
10.1.5.10 via 172.16.4.1 dev enp13s4f0 src 172.16.4.19 uid 0 
    cache 
10.1.5.72 via 10.212.154.34 dev enp13s4f1 src 10.212.154.35 uid 0 
    cache 

=== verify-gsm-config ===
=== GSM split routes ===
[0;32mOK[0m signal 10.1.5.8/29 via 172.16.4.1 enp13s4f0
[0;32mOK[0m media 10.1.5.64/27 via 10.212.154.34 enp13s4f1
[0;32mOK[0m no blanket 10.1.5.0/24
[0;32mOK[0m no legacy /32
[0;32mOK[0m signal not via media GW
[0;32mOK[0m media not via signal GW
[0;32mOK[0m no stale media via enp6s0f0

=== route get ===
10.1.5.10 via 172.16.4.1 dev enp13s4f0 src 172.16.4.19 uid 0 
    cache 
10.1.5.72 via 10.212.154.34 dev enp13s4f1 src 10.212.154.35 uid 0 
    cache 
[0;32mOK[0m 10.1.5.10 via signal path
[0;32mOK[0m 10.1.5.72 via media path (10.1.5.64/27)

=== .env ===
PUBLIC_DOMAIN=172.16.6.183
GSM_MEDIA_ADDRESS=10.212.154.35
GSM_SIGNAL_ADDRESS=172.16.4.19
SIP_PROVIDER_SIGNAL_NET=10.1.5.8/29
SIP_PROVIDER_MEDIA_NET=10.1.5.64/27
GSM_ROUTE_SIGNAL_NET=10.1.5.8/29
GSM_ROUTE_MEDIA_NET=10.1.5.64/27
GSM_ROUTE_SIGNAL_VIA=172.16.4.1
GSM_ROUTE_SIGNAL_DEV=enp13s4f0
GSM_ROUTE_MEDIA_VIA=10.212.154.34
GSM_ROUTE_MEDIA_DEV=enp13s4f1
GSM_UMG_TEST_IP=10.1.5.72
[0;32mOK[0m GSM_MEDIA_ADDRESS=10.212.154.35
[0;32mOK[0m GSM_SIGNAL_ADDRESS=.4.19
[0;32mOK[0m GSM_ROUTE_SIGNAL_VIA=.4.1
[0;32mOK[0m GSM_ROUTE_MEDIA_VIA=10.212.154.34
[0;32mOK[0m GSM_ROUTE_MEDIA_DEV=enp13s4f1
[0;32mOK[0m GSM_UMG_TEST_IP=10.1.5.72

=== Asterisk PJSIP (native) ===
[0;32mOK[0m match 10.1.5.8/29 (signal subnet)
[0;32mOK[0m match 10.1.5.64/27 (media subnet)
media_address=10.212.154.35
[0;32mOK[0m media_address=10.212.154.35
external_media_address=172.16.6.183
localnet=172.16.0.0/12
localnet=127.0.0.0/8
[0;32mOK[0m rtp external_media_address=172.16.6.183
[0;32mOK[0m no stale 10.0.0.0/8 localnet
external_media_address=172.16.6.183
external_media_address=172.16.6.183
[0;32mOK[0m pjsip external_media_address=172.16.6.183
[0;32mOK[0m pjsip vars substituted

=== RTP from GSM media subnet (any host in 10.1.5.64/27) ===
(no RTP from 10.1.5.x in log yet вАФ check during active call)

[0;32mOK[0m GSM config check passed

=== diag-audio (-w 8) ===

[1m== 1. –Ь–∞—А—И—А—Г—В—Л GSM (–њ–Њ–і—Б–µ—В–Є, –љ–µ /32) –Є rp_filter ==[0m
  —Б–Є–≥–љ–∞–ї–Є–љ–≥: 10.1.5.8/29
  –Љ–µ–і–Є–∞:     10.1.5.64/27
  route table (signal 10.1.5.8/29 via enp13s4f0, media 10.1.5.64/27 via enp13s4f1):
    10.1.5.8/29 via 172.16.4.1 dev enp13s4f0 
    10.1.5.64/27 via 10.212.154.34 dev enp13s4f1 
    [0;32mOK[0m route 10.1.5.8/29
    [0;32mOK[0m route 10.1.5.64/27
  rp_filter (0=off, 2=loose —А–µ–Ї–Њ–Љ–µ–љ–і—Г–µ—В—Б—П –і–ї—П –∞—Б–Є–Љ–Љ. GSM):
    net.ipv4.conf.all.rp_filter = [0;32m2[0m
    net.ipv4.conf.enp13s4f0.rp_filter = [0;32m2[0m
    net.ipv4.conf.enp13s4f1.rp_filter = [0;32m2[0m
    net.ipv4.conf.enp6s0f0.rp_filter = [0;32m2[0m

[1m== 2. PJSIP channelstats (RxPkt/TxPkt –њ–Њ –Ї–∞–љ–∞–ї–∞–Љ) ==[0m

                                             ...........Receive......... .........Transmit..........
 BridgeId ChannelId ........ UpTime.. Codec.   Count    Lost Pct  Jitter   Count    Lost Pct  Jitter RTT....
 ===========================================================================================================

 52e16ac1 1001-00000003      00:00:09 slin48    361       0    0   0.000    371       1    0   0.001   0.000
 52e16ac1 provider-00000002  00:00:10 alaw      480       0    0   0.000    362       0    0   0.000   0.000

Objects found: 2
[0;33m  ... –њ–∞—Г–Ј–∞ 8s, –њ–Њ–≤—В–Њ—А –і–ї—П –њ—А–Є—А–Њ—Б—В–∞ ...[0m

[1m== 2b. channelstats –њ–Њ–≤—В–Њ—А–љ–Њ (—Б—А–∞–≤–љ–Є—В–µ RxPkt/TxPkt) ==[0m

                                             ...........Receive......... .........Transmit..........
 BridgeId ChannelId ........ UpTime.. Codec.   Count    Lost Pct  Jitter   Count    Lost Pct  Jitter RTT....
 ===========================================================================================================

 52e16ac1 1001-00000003      00:00:17 slin48    763       0    0   0.001    773       1    0   0.000   0.006
 52e16ac1 provider-00000002  00:00:18 alaw      882       0    0   0.001    764       0    0   0.000   0.001

Objects found: 2

[1m== 3. –Т—Е–Њ–і—П—Й–Є–є RTP –Њ—В GSM (10.1.5.x)  [–њ–ї–µ—З–Њ GSM -> Asterisk] ==[0m
[0;33m  –≤ –ї–Њ–≥–µ –љ–µ—В 'Got RTP ... 10.1.5' (CC_RTP_DEBUG=1), –љ–Њ provider RxPkt=480[0m
[0;32m  -> GSM RTP –і–Њ—Е–Њ–і–Є—В –і–Њ Asterisk (—Б–Љ. channelstats –њ.2)[0m

[1m== 4. –Т—Е–Њ–і—П—Й–Є–є RTP –Њ—В –∞–≥–µ–љ—В–∞ (WebRTC)  [–њ–ї–µ—З–Њ –∞–≥–µ–љ—В -> Asterisk] ==[0m
[0;33m  –≤ –ї–Њ–≥–µ –љ–µ—В 'Got RTP ... 172.16.6.183' (CC_RTP_DEBUG=1), –љ–Њ agent TxPkt=371[0m
[0;32m  -> –Љ–Є–Ї—А–Њ—Д–Њ–љ –∞–≥–µ–љ—В–∞ –і–Њ—Е–Њ–і–Є—В –і–Њ Asterisk (channelstats)[0m

[1m== 5. –Т–µ—А–і–Є–Ї—В (channelstats вАФ –≥–ї–∞–≤–љ—Л–є –Є—Б—В–Њ—З–љ–Є–Ї; –ї–Њ–≥ вАФ —В–Њ–ї—М–Ї–Њ –њ—А–Є CC_RTP_DEBUG=1) ==[0m
  [0;32m–Ь–Њ—Б—В Asterisk OK[0m: provider Rx +402, agent Rx +402 –Ј–∞ 8s
     GSM -> PBX -> WebRTC –љ–∞ —Г—А–Њ–≤–љ–µ –њ–∞–Ї–µ—В–Њ–≤ —А–∞–±–Њ—В–∞–µ—В.
  [0;33m–Х—Б–ї–Є –∞–±–Њ–љ–µ–љ—В–∞ –љ–µ —Б–ї—Л—И–љ–Њ –њ—А–Є —А–∞—Б—В—Г—Й–µ–Љ in= –≤ –±—А–∞—Г–Ј–µ—А–µ:[0m
     - F12 [CC-RTP]: —Б–Љ–Њ—В—А–Є—В–µ audioLevel / totalAudioEnergy (–љ–µ —В–Њ–ї—М–Ї–Њ bytes)
     - chrome://webrtc-internals -> inbound-rtp audioLevel
     - –Я—А–Њ—Б–ї—Г—И–∞–є—В–µ MixMonitor: ls -lt /var/spool/asterisk/recordings/*/*/*.wav | head -3
     - tcpdump leg2: sudo tcpdump -ni enp6s0f0 src 172.16.6.183 and dst 192.168.0/16 and udp -c 30

[1m== 6. tcpdump-–њ–Њ–і—Б–Ї–∞–Ј–Ї–Є (–≤–Њ –≤—А–µ–Љ—П –Ј–≤–Њ–љ–Ї–∞, –Њ—В–і–µ–ї—М–љ—Л–µ —В–µ—А–Љ–Є–љ–∞–ї—Л) ==[0m
  GSM media:   sudo tcpdump -ni enp13s4f1 net 10.1.5.64/27 and udp -vv
  GSM SIP:     sudo tcpdump -ni enp13s4f0 net 10.1.5.8/29 and udp port 5060
  PBX -> –∞–≥–µ–љ—В: sudo tcpdump -ni enp6s0f0 src 172.16.6.183 and net 192.168.0/16 and udp

=== Got RTP from GSM (tail -c 3000000, last 10) ===
(none вАФ enable CC_RTP_DEBUG=1 for verbose RTP log)

=== Got RTP from agent WebRTC (172.16.6.183 in Asterisk log, last 5) ===
(none вАФ CC_RTP_DEBUG=0 or agent silent)

=== CC-TRACE last inbound 1263 ===
(none)

=== TCPDUMP leg1 (8s, enp13s4f1 net 10.1.5.64/27, media 10.212.154.35) ===
tcpdump: verbose output suppressed, use -v[v]... for full protocol decode
listening on enp13s4f1, link-type EN10MB (Ethernet), snapshot length 262144 bytes
10:59:51.670001 IP 10.1.5.72.61520 > 10.212.154.35.15316: UDP, length 172
10:59:51.673328 IP 10.212.154.35.15316 > 10.1.5.72.61520: UDP, length 172
10:59:51.689982 IP 10.1.5.72.61520 > 10.212.154.35.15316: UDP, length 172
10:59:51.690011 IP 10.212.154.35.15316 > 10.1.5.72.61520: UDP, length 172
10:59:51.709985 IP 10.1.5.72.61520 > 10.212.154.35.15316: UDP, length 172
10:59:51.710195 IP 10.212.154.35.15316 > 10.1.5.72.61520: UDP, length 172
10:59:51.729981 IP 10.1.5.72.61520 > 10.212.154.35.15316: UDP, length 172
10:59:51.730375 IP 10.212.154.35.15316 > 10.1.5.72.61520: UDP, length 172
10:59:51.750017 IP 10.1.5.72.61520 > 10.212.154.35.15316: UDP, length 172
10:59:51.750648 IP 10.212.154.35.15316 > 10.1.5.72.61520: UDP, length 172
10:59:51.770013 IP 10.1.5.72.61520 > 10.212.154.35.15316: UDP, length 172
10:59:51.770763 IP 10.212.154.35.15316 > 10.1.5.72.61520: UDP, length 172
10:59:51.790022 IP 10.1.5.72.61520 > 10.212.154.35.15316: UDP, length 172
10:59:51.790685 IP 10.212.154.35.15316 > 10.1.5.72.61520: UDP, length 172
10:59:51.809975 IP 10.1.5.72.61520 > 10.212.154.35.15316: UDP, length 172
10:59:51.810602 IP 10.212.154.35.15316 > 10.1.5.72.61520: UDP, length 172
10:59:51.829980 IP 10.1.5.72.61520 > 10.212.154.35.15316: UDP, length 172
10:59:51.830617 IP 10.212.154.35.15316 > 10.1.5.72.61520: UDP, length 172
10:59:51.850023 IP 10.1.5.72.61520 > 10.212.154.35.15316: UDP, length 172
10:59:51.850736 IP 10.212.154.35.15316 > 10.1.5.72.61520: UDP, length 172
10:59:51.870019 IP 10.1.5.72.61520 > 10.212.154.35.15316: UDP, length 172
10:59:51.871804 IP 10.212.154.35.15316 > 10.1.5.72.61520: UDP, length 172
10:59:51.890031 IP 10.1.5.72.61520 > 10.212.154.35.15316: UDP, length 172
10:59:51.891375 IP 10.212.154.35.15316 > 10.1.5.72.61520: UDP, length 172
10:59:51.910033 IP 10.1.5.72.61520 > 10.212.154.35.15316: UDP, length 172
10:59:51.912238 IP 10.212.154.35.15316 > 10.1.5.72.61520: UDP, length 172
10:59:51.930027 IP 10.1.5.72.61520 > 10.212.154.35.15316: UDP, length 172
10:59:51.930909 IP 10.212.154.35.15316 > 10.1.5.72.61520: UDP, length 172
10:59:51.950030 IP 10.1.5.72.61520 > 10.212.154.35.15316: UDP, length 172
10:59:51.950876 IP 10.212.154.35.15316 > 10.1.5.72.61520: UDP, length 172
10:59:51.970014 IP 10.1.5.72.61520 > 10.212.154.35.15316: UDP, length 172
10:59:51.970644 IP 10.212.154.35.15316 > 10.1.5.72.61520: UDP, length 172
10:59:51.990020 IP 10.1.5.72.61520 > 10.212.154.35.15316: UDP, length 172
10:59:51.992011 IP 10.212.154.35.15316 > 10.1.5.72.61520: UDP, length 172
10:59:52.010022 IP 10.1.5.72.61520 > 10.212.154.35.15316: UDP, length 172
10:59:52.010681 IP 10.212.154.35.15316 > 10.1.5.72.61520: UDP, length 172
10:59:52.030022 IP 10.1.5.72.61520 > 10.212.154.35.15316: UDP, length 172
10:59:52.030445 IP 10.212.154.35.15316 > 10.1.5.72.61520: UDP, length 172
10:59:52.049993 IP 10.1.5.72.61520 > 10.212.154.35.15316: UDP, length 172
10:59:52.050623 IP 10.212.154.35.15316 > 10.1.5.72.61520: UDP, length 172
40 packets captured
102 packets received by filter
0 packets dropped by kernel
LEG1 tcpdump summary: In=20 Out=20
VERDICT leg1: In present вАФ GSM RTP reaches PBX

=== TCPDUMP leg2 (PBX -> agent, enp6s0f0 src 172.16.6.183 dst 192.168.1.103) ===
tcpdump: verbose output suppressed, use -v[v]... for full protocol decode
listening on enp6s0f0, link-type EN10MB (Ethernet), snapshot length 262144 bytes
10:59:52.970209 IP 172.16.6.183.10838 > 192.168.1.103.58279: UDP, length 182
10:59:52.990147 IP 172.16.6.183.10838 > 192.168.1.103.58279: UDP, length 182
10:59:53.010219 IP 172.16.6.183.10838 > 192.168.1.103.58279: UDP, length 182
10:59:53.030314 IP 172.16.6.183.10838 > 192.168.1.103.58279: UDP, length 182
10:59:53.050185 IP 172.16.6.183.10838 > 192.168.1.103.58279: UDP, length 182
10:59:53.070166 IP 172.16.6.183.10838 > 192.168.1.103.58279: UDP, length 182
10:59:53.090127 IP 172.16.6.183.10838 > 192.168.1.103.58279: UDP, length 182
10:59:53.110367 IP 172.16.6.183.10838 > 192.168.1.103.58279: UDP, length 182
10:59:53.130472 IP 172.16.6.183.10838 > 192.168.1.103.58279: UDP, length 182
10:59:53.150374 IP 172.16.6.183.10838 > 192.168.1.103.58279: UDP, length 182
10:59:53.171396 IP 172.16.6.183.10838 > 192.168.1.103.58279: UDP, length 182
10:59:53.190320 IP 172.16.6.183.10838 > 192.168.1.103.58279: UDP, length 182
10:59:53.210455 IP 172.16.6.183.10838 > 192.168.1.103.58279: UDP, length 182
10:59:53.230322 IP 172.16.6.183.10838 > 192.168.1.103.58279: UDP, length 182
10:59:53.250243 IP 172.16.6.183.10838 > 192.168.1.103.58279: UDP, length 182
10:59:53.270297 IP 172.16.6.183.10838 > 192.168.1.103.58279: UDP, length 182
10:59:53.290225 IP 172.16.6.183.10838 > 192.168.1.103.58279: UDP, length 182
10:59:53.310270 IP 172.16.6.183.10838 > 192.168.1.103.58279: UDP, length 182
10:59:53.330230 IP 172.16.6.183.10838 > 192.168.1.103.58279: UDP, length 182
10:59:53.350135 IP 172.16.6.183.10838 > 192.168.1.103.58279: UDP, length 182
10:59:53.370205 IP 172.16.6.183.10838 > 192.168.1.103.58279: UDP, length 182
10:59:53.390274 IP 172.16.6.183.10838 > 192.168.1.103.58279: UDP, length 182
10:59:53.410240 IP 172.16.6.183.10838 > 192.168.1.103.58279: UDP, length 182
10:59:53.430273 IP 172.16.6.183.10838 > 192.168.1.103.58279: UDP, length 182
10:59:53.450284 IP 172.16.6.183.10838 > 192.168.1.103.58279: UDP, length 182
10:59:53.470251 IP 172.16.6.183.10838 > 192.168.1.103.58279: UDP, length 182
10:59:53.490181 IP 172.16.6.183.10838 > 192.168.1.103.58279: UDP, length 182
10:59:53.510187 IP 172.16.6.183.10838 > 192.168.1.103.58279: UDP, length 182
10:59:53.530237 IP 172.16.6.183.10838 > 192.168.1.103.58279: UDP, length 182
10:59:53.550222 IP 172.16.6.183.10838 > 192.168.1.103.58279: UDP, length 182
30 packets captured
50 packets received by filter
0 packets dropped by kernel
LEG2 tcpdump summary: packets=30
VERDICT leg2: PBX sends UDP toward agent

=== Combined verdict ===
RTP path OK on network (leg1 In + leg2 PBX->agent).
If subscriber still inaudible: check browser [CC-RTP] audioLevel, MixMonitor wav, UMG payload.

=== LEG2 hint (Asterisk -> agent 192.168.1.103) ===
Browser [CC-RTP]: in= grows but no voice -> check audioLevel, not only bytesReceived
  sudo tcpdump -ni enp6s0f0 src 172.16.6.183 and dst 192.168.1.103 and udp -c 30
  MixMonitor: ls -lt /var/spool/asterisk/recordings/*/*/*.wav | head -3
